{
  "schema_version": "1.0.0",
  "elements": [
    {
      "element_id": "elem-1",
      "type": "TASK",
      "name": "Process Order",
      "parent_id": null,
      "lane_id": "lane-1",
      "sub_type": null
    }
  ],
  "flows": [
    {
      "flow_id": "flow-1",
      "type": "SEQUENCE_FLOW",
      "source_ref": "elem-1",
      "target_ref": "elem-2",
      "is_default": false
    }
  ],
  "metadata": {
    "parse_mode": "STRUCTURED",
    "source_format": "bpmn",
    "confidence": 0.9,
    "warnings": []
  }
}
